{
  "$schema": "http://json-schema.org/draft-07/schema#",
  "title": "Task",
  "description": "A task in the Life Engine canonical data model.",
  "type": "object",
  "required": ["id", "title", "status", "priority", "source", "source_id", "created_at", "updated_at"],
  "properties": {
    "id": {
      "type": "string",
      "description": "Unique identifier assigned by Core"
    },
    "title": {
      "type": "string",
      "description": "Task title"
    },
    "description": {
      "type": "string",
      "description": "Detailed description of the task"
    },
    "status": {
      "type": "string",
      "enum": ["pending", "active", "completed", "cancelled"],
      "description": "Task status"
    },
    "priority": {
      "type": "string",
      "enum": ["none", "low", "medium", "high", "critical"],
      "description": "Task priority level"
    },
    "due_date": {
      "type": "string",
      "format": "date-time",
      "description": "Due date in ISO 8601 format"
    },
    "labels": {
      "type": "array",
      "items": { "type": "string" },
      "description": "User-defined labels for categorisation"
    },
    "source": {
      "type": "string",
      "description": "Identifier of the connector or plugin that produced this record"
    },
    "source_id": {
      "type": "string",
      "description": "The record's original ID in the source system"
    },
    "extensions": {
      "type": "object",
      "description": "Namespaced object for plugin-specific fields"
    },
    "created_at": {
      "type": "string",
      "format": "date-time",
      "description": "Record creation timestamp"
    },
    "updated_at": {
      "type": "string",
      "format": "date-time",
      "description": "Record last-updated timestamp"
    }
  },
  "additionalProperties": false
}
