{
  "id": "550e8400-e29b-41d4-a716-446655440000",
  "title": "Implement user authentication flow",
  "description": "Add OAuth2 PKCE flow for third-party identity providers",
  "status": "active",
  "priority": "high",
  "due_date": "2026-02-01T17:00:00Z",
  "labels": ["security", "backend", "phase-1"],
  "source": "manual",
  "source_id": "fixture-task-001",
  "extensions": {
    "com.life-engine.example": {
      "sprint": 3,
      "story_points": 8
    }
  },
  "created_at": "2026-01-15T10:30:00Z",
  "updated_at": "2026-01-15T10:30:00Z"
}
