{
  "id": "550e8400-e29b-41d4-a716-446655440002",
  "title": "Review pull request #42",
  "description": "Review the authentication refactor PR",
  "status": "pending",
  "priority": "medium",
  "due_date": "2026-01-18T10:30:00Z",
  "labels": [
    "review",
    "auth"
  ],
  "source": "test",
  "source_id": "test-task-001",
  "extensions": {
    "com.todoist.connector": {
      "project_id": "2345678",
      "section_id": "9876543"
    }
  },
  "created_at": "2026-01-15T10:30:00Z",
  "updated_at": "2026-01-15T10:30:00Z"
}
